{
  "schema_version": "1.0",
  "case_id": "SMOKE-001",
  "shop_name": "鉅記手信",
  "workflow": { "status": "needs_review", "current_stage": "human_review", "steps": [
    { "agent": "Paw-Archivist", "status": "completed", "label": "文化資產建檔", "summary": "已建立 1 個 claim" },
    { "agent": "Paw-Verifier", "status": "completed", "label": "來源核驗", "summary": "發現 1 個待處理問題" },
    { "agent": "Human Review", "status": "pending", "label": "人工審核", "summary": "需要處理來源衝突" }
  ] },
  "summary": { "total_claims": 1, "supported": 0, "partially_supported": 1, "unsupported": 0, "unverifiable": 0, "review_required": 1, "by_risk_flag": { "source_conflict": 1 } },
  "asset_card": { "basic_info": [], "products": [], "persons": [], "key_events": [], "operations": [ { "label": "澳門店鋪數量", "value": "21 家", "claim_id": "C051", "verification_status": "partially_supported" } ] },
  "claims": [ { "claim_id": "C051", "field": "operation", "label": "澳門店鋪數量", "value": "21 家", "verification_status": "partially_supported", "verification_level": "source_evidence", "risk_flags": ["source_conflict", "time_context_loss"], "source_ids": ["S2", "S5"], "reason": "S2 記載 21 家，S5 記載 13 家，可能反映不同時間點。" } ],
  "review_queue": [ { "issue_id": "I001", "claim_id": "C051", "severity": "high", "type": "source_conflict", "title": "店鋪數量存在來源衝突", "description": "S2 記載 21 家，S5 記載 13 家。", "recommended_actions": ["加入來源日期", "選用最新可核驗資料", "標記為待確認"] } ],
  "sources": [ { "source_id": "S2", "title": "來源 S2", "publisher": "示例發布者", "url": "https://example.com/s2", "content_type": "original_text", "verification_ceiling": "source_evidence" }, { "source_id": "S5", "title": "來源 S5", "publisher": "示例發布者", "url": "https://example.com/s5", "content_type": "original_text", "verification_ceiling": "source_evidence" } ],
  "publication": { "status": "needs_review", "blocking_claim_ids": ["C051"], "safe_to_publish": false }
}
